{
  "$schema": "https://ironcannon.dev/schemas/rule-fragment/v1",
  "id": "layer4/obligation/leg-w64-009",
  "layer": 4,
  "rulesetVersion": "2026.06.06",
  "content": {
    "requirement": "Stripe test mode keys blocked in production deploy",
    "obligations": [
      "LEG-W64-009"
    ],
    "compareSteps": [
      "Detect",
      "Map",
      "Disclaimer"
    ],
    "remediationDirective": "Stripe test mode keys blocked in production deploy"
  },
  "references": [
    "stripe/test-mode-block"
  ],
  "compliancePatterns": {
    "required": [
      {
        "id": "LEG-W64-009",
        "type": "config",
        "tier": "ironclad"
      }
    ]
  },
  "metadata": {
    "minTier": "ironclad",
    "category": "billing",
    "disclaimerRequired": true
  }
}
