{
  "$schema": "https://ironcannon.dev/schemas/rule-fragment/v1",
  "id": "layer4/obligation/leg-w63-001",
  "layer": 4,
  "rulesetVersion": "2026.06.06",
  "content": {
    "requirement": "MCP tool calls require wiremap attestation on gated tools",
    "obligations": [
      "LEG-W63-001"
    ],
    "compareSteps": [
      "Detect",
      "Map",
      "Disclaimer"
    ],
    "remediationDirective": "MCP tool calls require wiremap attestation on gated tools"
  },
  "references": [
    "owasp/cheatsheets-mcp-security-cheat-sheet-html"
  ],
  "compliancePatterns": {
    "required": [
      {
        "id": "LEG-W63-001",
        "type": "config",
        "tier": "ironclad"
      }
    ]
  },
  "metadata": {
    "minTier": "ironclad",
    "category": "security",
    "disclaimerRequired": true
  }
}
