{
  "$schema": "https://ironcannon.dev/schemas/rule-fragment/v1",
  "id": "layer4/obligation/leg-w53-001",
  "layer": 4,
  "rulesetVersion": "2026.06.03",
  "content": {
    "requirement": "RoPA entry for new processing after feature launch",
    "obligations": [
      "LEG-W53-001"
    ],
    "compareSteps": [
      "Detect",
      "Map",
      "Disclaimer"
    ],
    "remediationDirective": "RoPA entry for new processing after feature launch"
  },
  "references": [
    "legal/gdpr-ropa"
  ],
  "compliancePatterns": {
    "required": [
      {
        "id": "LEG-W53-001",
        "type": "manual",
        "tier": "ironclad"
      }
    ]
  },
  "metadata": {
    "minTier": "ironclad",
    "category": "privacy",
    "disclaimerRequired": true
  }
}
